{
  "$schema": "https://json-schema.org/draft/2020-12/schema",
  "$id": "https://yukkuricast.local/schema/yukkuricast-script.schema.json",
  "title": "YukkuriCast Script",
  "type": "object",
  "required": ["format", "version", "project", "characters", "scenes"],
  "properties": {
    "format": { "const": "yukkuricast-script" },
    "version": { "const": "1.0" },
    "project": {
      "type": "object",
      "required": ["title", "fps", "resolution", "theme"],
      "properties": {
        "title": { "type": "string", "minLength": 1 },
        "description": { "type": "string" },
        "fps": { "type": "integer", "minimum": 12, "maximum": 60, "default": 30 },
        "resolution": {
          "type": "object",
          "required": ["width", "height"],
          "properties": {
            "width": { "type": "integer", "minimum": 640, "maximum": 3840 },
            "height": { "type": "integer", "minimum": 360, "maximum": 2160 }
          }
        },
        "theme": {
          "type": "object",
          "required": ["palette", "subtitleStyle"],
          "properties": {
            "palette": { "enum": ["studio-dark", "paper-light", "cyber-classroom"] },
            "subtitleStyle": { "enum": ["pop", "news", "minimal"] },
            "bgm": { "enum": ["none", "soft", "news", "tech"] }
          }
        },
        "export": {
          "type": "object",
          "properties": {
            "gpuAcceleration": { "enum": ["auto", "off", "nvenc", "qsv", "amf"] },
            "videoBitrate": { "type": "string", "pattern": "^\\d+(k|K|m|M)?$" },
            "audioBitrate": { "type": "string", "pattern": "^\\d+(k|K|m|M)?$" },
            "audioSampleRate": { "enum": [44100, 48000] }
          }
        },
        "growth": {
          "type": "object",
          "properties": {
            "targetViewer": { "type": "string", "maxLength": 220 },
            "viewerPromise": { "type": "string", "maxLength": 260 },
            "coreQuestion": { "type": "string", "maxLength": 220 },
            "titleCandidates": {
              "type": "array",
              "maxItems": 8,
              "items": { "type": "string", "minLength": 1, "maxLength": 80 }
            },
            "thumbnailTexts": {
              "type": "array",
              "maxItems": 8,
              "items": { "type": "string", "minLength": 1, "maxLength": 20 }
            },
            "openingHook": { "type": "string", "maxLength": 260 },
            "retentionGoal": { "type": "string", "maxLength": 220 },
            "shortsHook": { "type": "string", "maxLength": 260 },
            "nextVideoIdea": { "type": "string", "maxLength": 220 }
          }
        },
        "readingDictionary": {
          "type": "array",
          "maxItems": 200,
          "items": { "$ref": "#/$defs/readingDictionaryEntry" }
        }
      }
    },
    "characters": {
      "type": "array",
      "minItems": 1,
      "maxItems": 6,
      "items": {
        "type": "object",
        "required": ["id", "name", "asset", "side", "voice"],
        "properties": {
          "id": { "type": "string", "pattern": "^[a-zA-Z0-9_-]+$" },
          "name": { "type": "string", "minLength": 1 },
          "asset": { "enum": ["reimu", "marisa", "akari", "kohaku", "aoba", "custom"] },
          "customAsset": {
            "type": "object",
            "required": ["id", "label", "filePath"],
            "properties": {
              "id": { "type": "string", "minLength": 1 },
              "label": { "type": "string", "minLength": 1 },
              "filePath": { "type": "string", "minLength": 1 },
              "previewUrl": { "type": "string" },
              "importedAt": { "type": "string" }
            }
          },
          "defaultEmotion": { "enum": ["neutral", "happy", "thinking", "surprised", "serious"] },
          "side": { "enum": ["left", "right"] },
          "voice": {
            "type": "object",
            "required": ["engine"],
            "properties": {
              "engine": { "enum": ["windows-sapi", "aquestalk-player"] },
              "voiceName": { "type": "string" },
              "aquestalkPreset": { "type": "string" },
              "rate": { "type": "integer", "minimum": -10, "maximum": 10 },
              "volume": { "type": "integer", "minimum": 0, "maximum": 100 }
            }
          }
        }
      }
    },
    "scenes": {
      "type": "array",
      "minItems": 1,
      "items": {
        "type": "object",
        "required": ["id", "title", "background", "shots"],
        "properties": {
          "id": { "type": "string", "minLength": 1 },
          "title": { "type": "string", "minLength": 1 },
          "summary": { "type": "string" },
          "background": {
            "type": "object",
            "required": ["type"],
            "properties": {
              "type": { "enum": ["gradient", "solid", "grid", "asset"] },
              "asset": {
                "enum": ["studio-grid", "paper-light", "classroom-board", "news-desk", "tatami-room", "night-city"]
              },
              "label": { "type": "string" },
              "from": { "$ref": "#/$defs/color" },
              "to": { "$ref": "#/$defs/color" },
              "color": { "$ref": "#/$defs/color" },
              "accent": { "$ref": "#/$defs/color" }
            }
          },
          "shots": {
            "type": "array",
            "minItems": 1,
            "items": {
              "type": "object",
              "required": ["id", "speakerId", "text", "duration"],
              "properties": {
                "id": { "type": "string", "minLength": 1 },
                "speakerId": { "type": "string", "minLength": 1 },
                "text": { "type": "string", "minLength": 1 },
                "duration": { "type": "number", "minimum": 1, "maximum": 45 },
                "emotion": { "enum": ["neutral", "happy", "thinking", "surprised", "serious"] },
                "layout": { "enum": ["duo", "left-focus", "right-focus", "solo-center"] },
                "caption": {
                  "type": "object",
                  "properties": {
                    "text": { "type": "string" },
                    "emphasis": { "type": "array", "items": { "type": "string" } },
                    "position": { "enum": ["bottom", "center"] }
                  }
                },
                "retention": {
                  "type": "object",
                  "properties": {
                    "beat": {
                      "enum": [
                        "hook",
                        "viewer-benefit",
                        "question",
                        "early-payoff",
                        "background",
                        "evidence",
                        "twist",
                        "climax",
                        "summary",
                        "next-video"
                      ]
                    },
                    "chapterLabel": { "type": "string", "maxLength": 60 },
                    "viewerQuestion": { "type": "string", "maxLength": 120 },
                    "visualChange": { "type": "string", "maxLength": 120 },
                    "sourceNote": { "type": "string", "maxLength": 160 },
                    "nextCuriosity": { "type": "string", "maxLength": 120 }
                  }
                },
                "visuals": {
                  "type": "array",
                  "items": {
                    "type": "object",
                    "required": ["type", "title"],
                    "properties": {
                      "type": {
                        "enum": [
                          "image",
                          "keyword",
                          "bullet",
                          "chart",
                          "code",
                          "question",
                          "timeline",
                          "comparison",
                          "source",
                          "map",
                          "chapter"
                        ]
                      },
                      "title": { "type": "string", "minLength": 1 },
                      "body": { "type": "string" },
                      "items": { "type": "array", "items": { "type": "string" } }
                    }
                  }
                },
                "assets": {
                  "type": "array",
                  "items": { "$ref": "#/$defs/timelineAsset" }
                },
                "notes": { "type": "string" }
              }
            }
          }
        }
      }
    }
  },
  "$defs": {
    "color": {
      "type": "string",
      "pattern": "^#([0-9a-fA-F]{3}|[0-9a-fA-F]{6})$"
    },
    "timelineAsset": {
      "type": "object",
      "required": ["id", "type", "track", "label"],
      "properties": {
        "id": { "type": "string", "minLength": 1 },
        "type": { "enum": ["placeholder", "image", "video", "audio", "telop", "effect"] },
        "track": { "enum": ["video", "character", "voice", "telop", "effect"] },
        "label": { "type": "string", "minLength": 1 },
        "start": { "type": "number", "minimum": 0 },
        "duration": { "type": "number", "minimum": 0.1, "maximum": 600 },
        "source": { "type": "string", "minLength": 1 },
        "placeholder": { "type": "boolean" },
        "position": {
          "enum": ["main-left", "main-center", "main-right", "top-left", "top-right", "lower-third", "fullscreen"]
        },
        "opacity": { "type": "number", "minimum": 0, "maximum": 1 },
        "notes": { "type": "string" }
      }
    },
    "readingDictionaryEntry": {
      "type": "object",
      "required": ["surface", "reading"],
      "properties": {
        "id": { "type": "string", "minLength": 1, "maxLength": 80 },
        "surface": { "type": "string", "minLength": 1, "maxLength": 80 },
        "reading": { "type": "string", "minLength": 1, "maxLength": 120 },
        "enabled": { "type": "boolean" },
        "caseSensitive": { "type": "boolean" },
        "source": { "enum": ["builtin", "user", "project"] }
      }
    }
  }
}
